review,name
이 영화가 미친 이유를 가지 말씀드리겠습니다,서브스턴스
부위별로 나눠서 품평하고 오래되면 신선하지 않다고 버려진다면 인간은 한낱 고깃덩어리와 다를 바 없다,서브스턴스
찬란하고 기괴하며 역겨우면서도 아름다운 영화 씨발,서브스턴스
외모보다는내면의아름다움이중요하다,서브스턴스
미디어에 의해 극단적으로 요구되는 아름다움에 대한 잔혹하고도 슬픈 풍자,서브스턴스
영화 서브스턴스 뜻 정보 출연진 관람평점 줄거리 리뷰 결말 후기 스포 쿠키 외모지상주의를 신랄하게 비판하는 하드고어 영화추천,서브스턴스
몰입도 색감 너무 좋다 다만 후반부에 힘들다,서브스턴스
세련된 음악과 기괴한 바디호러만으로 채우기 급급한 불쾌감,서브스턴스
다 좋은데 마지막에 분수쇼는 좀,서브스턴스
자신의 모든 걸 싫어해 본 사람들에게 바치는 영화,서브스턴스
상영 내내 쉼없는 미친 영화 인정 서브스턴스 키노라이츠 시사 후기,서브스턴스
메시지는 약간은 진부할 수도 있지만 신선하고 도발적이며 그로테스크한 연출과 영상미만으로도 충분히 볼만한 작품,서브스턴스
마지막에 김건희의 말로가 나오는건 신의 한수였다,서브스턴스
너무나 감각적이라 힘들다,서브스턴스
감독나와 고어물이라고 미리 알려줬어야지 영화보고 알탕 끊는다 영화보다가 중간에 토할뻔 했다,서브스턴스
친절히 뇌뚜껑을 직접 열고 쑤셔 넣어주는 메시지,서브스턴스
나는 나를 사랑하는가,서브스턴스
이러한 소재로 이렇게 끌고 갈 감독이 몇이나 될까 그로테스크를 좋아하는 사람에게는 최고의 영화,서브스턴스
캐리의 재림,서브스턴스
선택 절제가 얼마나 중요한지와 지금의 나를 사랑하고 아껴야 한다는 메시지를 주는 충격적인 명작,서브스턴스
역하다 아니 사회의 시선이 역한걸지도,서브스턴스
미적 기준이 외부가 아니라 나에게서 비롯되어야 한다는 쉽지만 강렬한 메시지 흉측하고 기괴한 표현방식에는 주의가 필요하다,서브스턴스
엘리자베스와 수를 섞은 진정한 나 를 드러냈을 때 나오는 대중의 기괴한 반응,서브스턴스
가장 작은 것에서부터 가장 큰 것에서까지,서브스턴스
끝내 진다 영화적으로도 철학적으로도 끝내주는 쾌감뒤에 스믈스믈 올라오는 비정한 올드 앤 뉴 살과 탐욕 죽음 보다 못한 삶 이 극강의 연출로 펼쳐진다 캐리만큼 슬펐다,서브스턴스
난 왜 이 영화 슬프지,서브스턴스
보다가 등받이에 등을 떼고 본 영화가 너무 오랜만이었다 중간에 실소도 나오고 눈살도 찌푸러지고 어이없이 웃기도 하고 징그럽다가 아름답다가 모든 걸 다 느낀 영화,서브스턴스
자아를 망각한 또 다른 나의 청춘에 대한 집착,서브스턴스
후반부로 갈수록 고어물이 되어가지만 볼 만하고 무엇보다 전신성형을 했다는 데미무어가 주연을 하다보니 뭔가 더 개연성이 있어보인다랄까 그럭저럭 볼만함,서브스턴스
서브스턴스,서브스턴스
시각적인 만족도가 극강에 달하는 영화 연출이 예술적이다 데미무어 자신의 이야기처럼 연기해내주어 몰입도가 더 높아진다 뒤로 갈수록 상상력의 한계를 뛰어넘어 웃음이 터지는 취향저격,서브스턴스
과하다고 생각하면서도 납득이 가는 연출,서브스턴스
인간의 탐욕은 끝이 없다,서브스턴스
레전드 정신병원,서브스턴스
아름다움 스타에 대한 고정관념 을 가지고 집착을 하는 우리가 괴물,서브스턴스
크레이지하고 섹시하고 호러블하고 쇼킹하다 초반에 여체를 다양하게 보여주며 눈을 즐겁게 하지만 후반에 거의 고어물로 변한다 스마일 에서의 엔딩장면과 비슷하면서도 더 충격적,서브스턴스
외모집착정병을 바디호러로써 비판하는듯하다가 추에 대한 충격을 그 도구로 사용하는 순간 주제는 빛을 잃어버리고 급기야는 급 프릭쇼 몬스터 포르노가 되어버린다,서브스턴스
고어 기괴함 불쾌함이 연속으로 터지는 미친 대환장의 향연 맨 정신으로 절대 보면 안되는 올해 최고의 문제작,서브스턴스
성과 외모 젊음 등등 사회의 고착화된 생각 이미지를 향한 거침없는 풍자를 통해 본질 에 도달하는 충격적인 이미지의 향연과 에너지 배기 발화 폭발로 마무리되는 칵 퉤,서브스턴스
모든 것이 제 자리에 있다는 것을 논하기엔 우리 눈만으로는 부족할 수 있음을,서브스턴스
다음이 없을 내 아름다운 삶을 위해 부디 나를 조금 더 사랑하자,서브스턴스
재미는 있었는데 너무 힘들었어요,서브스턴스
데미무어의 말년이여서 시도할 수 있는 과감한 시도의 괴작 소재는 신선했으나 결말까지 가는데에 브레이크가 없다,서브스턴스
광란의 토마토 축제 미를 향한 광적인 집착을 더욱 광적으로 묘사하는 영화,서브스턴스
불이 켜지고 오금이 저려서 잘 못 걸을 것 같은 영화가 있다 이 영화가 그렇다 여성 스타 의 흥망성쇠를 이렇게 표현해도 되나 싶을 정도로 끝까지 간다,서브스턴스
징그러운걸 못보는 분은 추천하지못한다 데미무어의 몸매감상은 할수있고 주제는 명확하나 너무 노골적으로 불쾌한게 많다,서브스턴스
왜 포스터에 이라고 적었는지 알겠다 근데 좀 뇌절이다 고어 못 보면 보지 말 것,서브스턴스
메시지가 강한 영화인건 맞는 것 같은데 내가 싫어하는 장르,서브스턴스
미친영화,서브스턴스
레퀴엠 에 존 카펜터 크리쳐 무비를 곁들인 느낌 프로듀서 하비 역 맡은 배우가 페어런트 트랩 의 아빠였다니 충격,서브스턴스
뭔지 알겠는데 보고나면 뭔가 찝찝하다 사운드도 한몫하지 않았나,서브스턴스
좋은 영화인건 알겠는데 내내 언제끝나나 기다리게 됨 후반부 가서는 작정했구나 싶었음 보기힘들어서 삼점,서브스턴스
이렇게까지 해야 하는 이유를 깨달으면 점을 안줄수가 없지,서브스턴스
외모지상주의와 알 수 없는 유리천장을 꼬집는 영화 외모지상주의를 비판하는 영화지만 나도 모르게 영화를 보며 배우들의 외모에 감탄하고 경악한다,서브스턴스
중반까지 괜찮았는데 후반에는 너무 메시지 전달에 치중해서 밸런스를 잃어버린,서브스턴스
와아아아아우 시간동안 싸대기 맞고 온 느낌 영화의 정체성에 대해 이해하고 싶지만 전 아직 많이 부족한가 봅니다 재미는 있으나 엄청 추천은 안할것 같은 끝으로 갈수록,서브스턴스
영화를 보는 내내 데미무어의 고통스러움이 고스란히 느껴지는 작품이었다 젊음이 무엇인지 외모가 무엇인지 관객에게 그 고통을 간접 체험하게 하면서 생각하게 하는 작품,서브스턴스
스탠리큐브릭 데이빗린치보단 데이빗 크로넨버그에 가까운 플라이와 익스텐션을 요즘 영화문법으로 풀다 음향만큼은 인정,서브스턴스
오히려 고어해서 메세지가 와닿는 것 같다,서브스턴스
전하려는 메시지는 확실하게 알수 있음 지루할틈 없이 중후반까지 전개 잘가다가 어 여기서 한발 더 나간다고 하는 지점부터 약간 뇌절좀 하는데 나쁘진 않음 시청은 주의,서브스턴스
마지막엔 너무 좋아서 입을 다물지 못했다 영화에서 신랄하다는 건 이럴 때 쓰는 표현이구나 안본눈사요 다시보게,서브스턴스
분까지 할 필요는 없었을 것 같아,서브스턴스
오래된 신문지에 썼지만 필체가 선명해 알아보기 쉬운 메시지,서브스턴스
어휴 주사도 못맞는데 이걸 본 나 자신 대견하다 미친연출,서브스턴스
감각적인 사운드와 어울러 상당히 그로테스크한 비주얼이 그 자체로 선사하는 얼얼한 충격은 결국 나를 인정하지 않고서는 그 무엇도 온전히 나일 수 없음을 말하는 영화의 본질로 이어진다,서브스턴스
내가 지금 뭘 본거지,서브스턴스
세월이란 생의 순리를 역행하려는 탐욕 그리고 그걸 부추기는 피빛 난리로도 부족한 역겨운 미디어 유니크하고 강렬하여 쉽게 잊혀지지 않을 경험,서브스턴스
전달하려는 메세지에 비해 연출이 너무 극단적이었다 궃이 마지막 장면까지 갈 필요가 있었을까,서브스턴스
진짜 기괴하다 몰입감 엄청 남,서브스턴스
곱씹어볼수록 더 기괴하고 흥미로운 영화 자꾸 생각난다,서브스턴스
후반부 살짝 아쉬웠는데 진짜 공포를 느낄 수 있었던 것 같아서 만족,서브스턴스
이런 끔찍한 영화를 안본 눈이 더 좋다,서브스턴스
점점 고조되더니 이내 터져버린다,서브스턴스
창의적이면서 괴랄한 바디 호러무비 인생을 담보로 젊음을 갈구하는 인간의 욕심과 늙어서도 미를 갈구하는 인간의 본능을 풍자,서브스턴스
해서 좋았다 잘 만든 뮤비를 보는 느낌이었다,서브스턴스
오감이 다 역겨워져 몸이 부들거렸던 과욕에 대한 본능 신랄하고 직관적인 또 과감한 연출 엽기 그 자체였다,서브스턴스
엘리자베스 스파클만이 아닌 모든 여성에게 더 나은 나 는 단순히 껍데기에서만 나온다는 게 아닌 걸 피로 몸소 알려주는 영화,서브스턴스
당신들은 왜 과거에 얽매어있나요 한낱 나약한 인간의 자기 파괴적인 순간,서브스턴스
피눈물로 만든 작품이라 두 번은 못 보겠다,서브스턴스
부정의 엽기적 극치,서브스턴스
이런 스토리는 대체 어떻게 나오는 걸까,서브스턴스
무수한 강박이 또 다른 나의 욕망과 욕심을 빚어낸다 때로는 인정하는 용기가 필요하다 나를 위해서라도,서브스턴스
머리에 콕콕 박히는 영화는 첨이었어요 보고나서 잠에 들때까지 이 영화만 생각하면서 잠 듦 내용이 이해되게 징그러워서 보는 내내 무서웠어요 다시 한 번 더 보고 싶은 영화임,서브스턴스
젊음의 노화는 인류의 산물,서브스턴스
살다 살다 중간 아니 막판 에 뛰쳐나오고 싶었던 영화는 처음,서브스턴스
극한의 강렬함에 다다른 끝에야 비로소 말하고픈 본질이 튀어나온다,서브스턴스
후반부가 뇌절급이지만 몰입도높은 영화,서브스턴스
너는 거기 없고 지금 여기 있다,서브스턴스
극 내내 주인공의 행동이 답답하고 화나지만 그만큼 공감되는 지점도 있어 슬펐다 풍자와 혐오 사이라는 평이 공감됨 다만 청각적 연출이 정말 훌륭함,서브스턴스
이 영화가 년은 빨리 나왔으면 내 외모 정병 다 고쳤을 텐데,서브스턴스
처음엔 엉망진창 싸구려라고생각했는데 시간지나면서 계속생각남 후반부 여주인공이 화나서 데미무어 쫓아가는장면이 내가좋아하는 장면,서브스턴스
럽마셆 그들의 싸움이 너무나도 슬프다 자기혐오 자기파괴하는 모습이 이렇게 슬픈거였구나,서브스턴스
내가 나를 사랑하지 않는 순간부터 난 나를 죽일 수 있게 된다,서브스턴스
도리언그레이 앤 하이드 인 할리우드,서브스턴스
나도 나 자신을 사랑하고 싶었어 처절하게,서브스턴스
화려한 연출을 좋아한다면 최고의 영화일 것 같다,서브스턴스
여자들이라서 만들 수 있는 영화 그 자체,서브스턴스
대단히 기괴하다 이런 영화를 만 명이나 봤다는 게 놀라울 따름,서브스턴스
액셀을 밟고 싶다면 뒤를 돌아보지말고 풀악셀로 밟을것,서브스턴스
허상뿐인 가면들을 벗고 결국 찾는 건 자신의 얼굴,서브스턴스
슈퍼파월,서브스턴스
나 자신이 싫어서 새로운 나를 탄생시키지만 결국 그마저도 또다른 욕망을 불러 새로운 나에게 잡아먹힌다,서브스턴스
사라진 조커가 여기 있었네,서브스턴스
작중에서는 육체를 파먹히는 것으로 묘사가 됐지만 실제로는 영혼을 깎아먹히고 있었던 것이다 한편 사람의 눈으로은 고귀한 영혼은 볼 수 없고 그저 육체만 볼 수 있다는 것,서브스턴스
미친,서브스턴스
개봉 일째되는 날에 처음으로 보고 두어번 더 본 영화 확실히 이영화를 처음 봤을때 주었던 강렬함은 인상깊긴 했다,서브스턴스
오늘부터 내 자신을 더욱 사랑해야겠다는 결심을 하게 만드는 영화 끊임없는 자기 혐오 아름다움의 집착이 보여주는 파격적이고 강렬한 붉은 빛의 호러쇼 이 영화는 미쳤다,서브스턴스
자기자신을 처절하게 파괴하면서도 결국 놓치 못한 사람들의 관심과 사랑,서브스턴스
