review,name
사람은 항상 선하고 또 진실되어야 함을 다시금 배운다,히든 페이스
바람둥이 남자 질투로 사랑을 확인하려는 여자 금방 사랑에 빠지는만큼 소유욕 강한 또 다른 여자가 만들어내는 조화롭고 쫀득한 하모니,히든 페이스
원래 사람 마음 가지고 장난치면 천벌받는거야 다들 자기 무덤 자기가 팠네,히든 페이스
재밌는데 왜 니들끼리 그래요 문 열어,히든 페이스
제 무덤 파고 있다 깨닫게 된 현실 마주보기,히든 페이스
뒷 이야기를 더 보고싶은데,히든 페이스
그야말로 꿀잼 초반 지루할수 있는 위기를 여배우의 외모와 노출로 영악하게 모면했다 네이버 다음 줄거리 자체가 스포이므로 스킵하고 본다면 재미는 보장,히든 페이스
한국 리메이크와 비교해 볼 수 있는 재미,히든 페이스
내가 너 그럴 줄 알았다,히든 페이스
남자가 범인이라고 생각한 거 나만 그런가,히든 페이스
사람이길 포기하지말자,히든 페이스
넷플릭스에 있길래 본 영화 확실히 국내 리메이크와는 다른 것도 있지만 어느정도의 공통점도 있긴 했다,히든 페이스
히든 페이스 결국 모두가 겉으로 드러난 얼굴 뒤에 또다른 얼굴을 숨기고 있겠지,히든 페이스
끼리끼리,히든 페이스
단 한 명도 착한 사람이 없네,히든 페이스
그런식으로 남자를 시험하는 건 좋지 않아 구하러 들어간 파비아나를 가두고 나온거 보니 정말 처음부터 끝까지 못 됐다,히든 페이스
깔끔하게 드러낸다,히든 페이스
한국 승,히든 페이스
자잘한 기교보다는 묵직한 비밀 하나로 극을 이끌어나간다,히든 페이스
흥미로운 설정인데 마지막이 끝내 완벽하지 못했다 그런데 한국 리메이크는 이걸 해낸다,히든 페이스
흥미가 가는 소재와 설정으로 무난하게 전개되는 영화 다소 비어있고 부족한 느낌이 드는데 곁가지를 덜어내며 집중하게 하지만 캐릭터성과 서사가 사라지며 밋밋한 느낌이 들고만다,히든 페이스
벽하나를 사이에둔 두여자의 심리극,히든 페이스
밀실 콘셉트로 밀어붙이는 섹슈얼 치정극,히든 페이스
초반 노출신은 영화를 다 보고나서 수긍하게 되었다,히든 페이스
질투가 죽음을 부른다,히든 페이스
지독하게들 사랑하고 계시네요,히든 페이스
될성부른 나무 클라라 라고,히든 페이스
그럭저럭,히든 페이스
독특한 전개 덕분에 보게 되는 스릴러,히든 페이스
사랑이 가지는 알량한 면모에 관하여,히든 페이스
영화 흐름에 따라 인물들 인상이 달라 보이는 마법,히든 페이스
나름 신선한 소재에 서비스 컷,히든 페이스
그럴싸한 장치와 반전을 통해서 영화에 몰입감을 이끌어내는데 성공한다,히든 페이스
긴장감 그리고 반전들로 스릴 있는 영화,히든 페이스
